<?xml version="1.0" encoding="UTF-8"?>

<N95LGI xmlns:xsi="http://www.w3.org/2001/XMLSchema-instance" xsi:noNamespaceSchemaLocation="NVI_XML_Schema.xsd">
    <!-- Ettermek -->
    <etterem ekod="e1">
        <nev>Trófea</nev>
        <cim>
            <varos>Budapest</varos>
            <utca>Visegrádi</utca>
            <hazszam>13</hazszam>
        </cim>
        <csillag>4</csillag>
    </etterem>
    
    <etterem ekod="e2">
        <nev>Gundel</nev>
        <cim>
            <varos>Budapest</varos>
            <utca>Gundel Károly</utca>
            <hazszam>4</hazszam>
        </cim>
        <csillag>5</csillag>
    </etterem>
    
    <!-- Foszakacsok -->
    <foszakacs fkod="f1" e_f="e1">
        <nev></nev>
        <eletkor>23</eletkor>
        <vegzettseg></vegzettseg>
        <vegzettseg></vegzettseg>
    </foszakacs>
    
    <foszakacs fkod="f2" e_f="e2">
        <nev></nev>
        <eletkor>23</eletkor>
        <vegzettseg></vegzettseg>
    </foszakacs>
    
    <!-- Szakacsok -->
    <szakacs szkod="sz1" e_sz="e1">
        <nev></nev>
        <reszleg></reszleg>
        <vegzettseg></vegzettseg>
        <vegzettseg></vegzettseg>
        <vegzettseg></vegzettseg>
    </szakacs>
    
    <szakacs szkod="sz2" e_sz="e1">
        <nev></nev>
        <reszleg></reszleg>
        <vegzettseg></vegzettseg>
        <vegzettseg></vegzettseg>
        <vegzettseg></vegzettseg>
    </szakacs>
    
    <szakacs szkod="sz3" e_sz="e2">
        <nev></nev>
        <reszleg></reszleg>
        <vegzettseg></vegzettseg>
        <vegzettseg></vegzettseg>
        <vegzettseg></vegzettseg>
    </szakacs>
    
    <szakacs szkod="sz4" e_sz="e2">
        <nev></nev>
        <reszleg></reszleg>
        <vegzettseg></vegzettseg>
        <vegzettseg></vegzettseg>
        <vegzettseg></vegzettseg>
    </szakacs>
    
    <!-- Gyakornokok -->
    <gyakornok gykod="gy1" e_gy="e1">
        <nev></nev>
        <gyakorlat>
            <kezdete></kezdete>
            <idotartama></idotartama>
        </gyakorlat>
        <muszak></muszak>
    </gyakornok>
    
    <gyakornok gykod="gy2" e_gy="e2">
        <nev></nev>
        <gyakorlat>
            <kezdete></kezdete>
            <idotartama></idotartama>
        </gyakorlat>
        <muszak></muszak>
    </gyakornok>
    
    <!-- Vendegek -->
    <vendeg vkod="v1">
        <nev>Német Viktor</nev>
        <eletkor>23</eletkor>
        <cim>
            <varos>Miskolc</varos>
            <utca>Kossuth Lajos</utca>
            <hazszam>44</hazszam>
        </cim>
    </vendeg>
    
    <vendeg vkod="v2">
        <nev>Ujlaki Róbert</nev>
        <eletkor>23</eletkor>
        <cim>
            <varos>Budapest</varos>
            <utca>Váci</utca>
            <hazszam>1</hazszam>
        </cim>
    </vendeg>
    
    <!-- Rendelesek -->
    <rendeles e_v_e="e1" e_v_v="v1">
        <osszeg>9000</osszeg>
        <etel>Steak</etel>
    </rendeles>
    
    <rendeles e_v_e="e1" e_v_v="v2">
        <osszeg>2500</osszeg>
        <etel>Leves</etel>
    </rendeles>
    
    <rendeles e_v_e="e2" e_v_v="v1">
        <osszeg>3500</osszeg>
        <etel>Mákos guba</etel>
    </rendeles>
    
    <rendeles e_v_e="e2" e_v_v="v2">
        <osszeg>3600</osszeg>
        <etel>Tészta</etel>
    </rendeles>
</N95LGI>
